prerequisites,course,description,unit
 none.			,COMPLIT 133 Contemporary Imagination in Literature and the Arts,"			Introduction to comparative literature, focusing on the study of world literatures and their relations to other arts, and to cultural and social currents.		",3 cr. Undergraduate.		
 none.			,CIV ENG 150 Builders for Civilization and Environment,"			Explores the role of civil engineering in society through the use of case studies, including water and society, bridges, building and transportation.		",3 cr. Undergraduate.		
 none.			,COMSDIS 210 Survey of Communication Disorders,"			A broad overview of speech, language, and hearing disorders. Normal development, adult functions and cultural differences are explored, as well as general approaches to rehabilitation.		",3 cr. Undergraduate.		
 none.			,CELTIC 103 First Semester Gaelic,			Beginning Gaelic for students with no previous knowledge of the language. Counts as repeat of Linguis 131 with 'First Semester Gaelic' subtitle.		,3 cr. Undergraduate.		
 none.			,COMMUN 101 Introduction to Interpersonal Communication,			Basic concepts for understanding communication in interpersonal relationships. Combines a theoretical approach with a skills approach to the study of interpersonal communication.		,3 cr. Undergraduate.		
 Math 221(C) or Math 231(C).			,BME 101 Fundamentals of Biomedical Engineering,"			A system approach to physiology, cell physiology and transport, major organ systems,cardiovascular system, biomedical signal processing, biomechanics, biomedical engineering design.		",3 cr. Undergraduate.		
 grad st & Bus Adm 703(P).			,BUSMGMT 704 Accounting Analysis and Control,"			Prepares managers to critically analyze, interpret and use financial statements, cost reports, and other financial information provided by accountants and accounting systems.		",3 cr. Graduate.		
 Math 105(C) or Math 108(C) or Math 116(C) or Level 30 on Math Placement Test.			,CHEM 100 Chemical Science,"			Introductory course in general inorganic chemistry designed for the student with little or no previous science training. 3 hrs lec, 1 hr dis.		",4 cr. Undergraduate.		
 none.			,BMS 101 Introduction to Clinical Laboratory Sciences,			Lecture and laboratory instruction to introduce the student to the profession of clinical laboratory sciences with special emphasis in medical technology and cytotechnology.		,2 cr. Undergraduate.		
 none.			,BIO SCI 100 Survey of Zoology,"			Survey of the animal kingdom, with emphasis on the importance of animals to humans. Study of phyla as represented by types, classification, structure, and life histories. Introduction to cytology, genetics, evolution, and ornithology. 2 hrs lec, 2 hrs lab.		",3 cr. Undergraduate.		
" not open for cr or regis to Business jr, pre-Business sr, or Business sr.			",BUS ADM 100 Introduction to Business,"			Introduction to the nature and functions of business, the culture of the business world and business education, and the skills to be successful in both.		",3 cr. Undergraduate.		
